{
  "$schema": "https://cdn.jsdelivr.net/npm/@docubook/flame/docu.schema.json",
  "meta": {
    "title": "DocuBook Flame",
    "description": "A markdown-first documentation framework. Write with directives, compile to flat static HTML — no runtime, no server, no lock-in. Runs on Bun, Node.js, or Deno.",
    "baseURL": "https://docs.docubook.pro/",
    "favicon": "/docs/assets/images/favicon.ico",
    "ogImage": "/docs/assets/images/og.png"
  },
  "sidebar": {
    "context": "separator"
  },
  "themes": {
    "colors": "default"
  },
  "home": {
    "hero": {
      "tagline": "DocuBook Flame - v2",
      "headline": "Compile markdown. Deploy anything.",
      "description": "No runtime, no server to run, no lock-in. One markdown format, readable by humans and agents alike, compiled to flat static HTML — deploy anywhere.",
      "actions": [
        {
          "text": "Get Started",
          "link": "/docs/getting-started/introduction",
          "theme": "primary"
        },
        {
          "text": "GitHub",
          "link": "https://github.com/DocuBook/docubook",
          "theme": "ghost",
          "icon": "github"
        }
      ]
    },
    "features": [
      {
        "icon": "Zap",
        "title": "Lightning Fast",
        "description": "Powered by Bun for instant builds and hot module replacement.",
        "link": "/docs"
      },
      {
        "icon": "Paintbrush",
        "title": "Themeable",
        "description": "Customize with Tailwind CSS and DaisyUI for beautiful documentation.",
        "link": "/docs/getting-started/themes"
      },
      {
        "icon": "Search",
        "title": "Full-Text Search",
        "description": "Built-in search with Algolia integration for easy content discovery.",
        "link": "/docs/getting-started/search/built-in"
      }
    ]
  },
  "navbar": {
    "logo": {
      "src": "/docs/assets/images/icon.svg",
      "alt": "DocuBook"
    },
    "logoText": "DocuBook",
    "menu": [
      {
        "title": "Home",
        "href": "/"
      },
      {
        "title": "Docs",
        "href": "/docs"
      }
    ]
  },
  "footer": {
    "social": [
      {
        "name": "facebook",
        "url": "https://www.facebook.com/wildan.nrsh"
      },
      {
        "name": "instagram",
        "url": "https://www.instagram.com/wildan.nrs/"
      },
      {
        "name": "npm",
        "url": "https://www.npmjs.com/~wildan.nrs"
      },
      {
        "name": "youtube",
        "url": "https://youtube.com/@wildandotdev"
      },
      {
        "name": "x",
        "url": "https://x.com/wildan_nrss"
      },
      {
        "name": "threads",
        "url": "https://www.threads.com/@wildan.nrs"
      }
    ]
  },
  "repo": {
    "url": "https://github.com/DocuBook/docubook",
    "path": "blob/main/packages/flame/{filePath}",
    "edit": true
  },
  "routes": [
    {
      "title": "Getting Started",
      "href": "/getting-started",
      "noLink": true,
      "context": {
        "icon": "BookOpen",
        "description": "Set up your Documentation",
        "title": "Guides"
      },
      "items": [
        {
          "title": "Introduction",
          "href": "/introduction"
        },
        {
          "title": "Installation",
          "href": "/installation"
        },
        {
          "title": "Quick Start Guide",
          "href": "/quick-start-guide"
        },
        {
          "title": "Configuration",
          "href": "/configuration"
        },
        {
          "title": "Formatting",
          "href": "/formatting"
        },
        {
          "title": "Frontmatter",
          "href": "/frontmatter"
        },
        {
          "title": "Themes",
          "href": "/themes"
        },
        {
          "title": "Plugins",
          "href": "/plugins"
        },
        {
          "title": "Deployment",
          "href": "/deployment"
        },
        {
          "title": "Base Path & Subpaths",
          "href": "/base-path"
        },
        {
          "title": "Search",
          "href": "/search",
          "noLink": true,
          "items": [
            {
              "title": "Built-in",
              "href": "/built-in"
            },
            {
              "title": "Algolia",
              "href": "/algolia"
            }
          ]
        }
      ]
    },
    {
      "title": "Components",
      "href": "/components",
      "noLink": true,
      "context": {
        "icon": "Layers",
        "description": "Write with Markdown",
        "title": "Markdown"
      },
      "items": [
        {
          "title": "Accordion",
          "href": "/accordion"
        },
        {
          "title": "Accordion Group",
          "href": "/accordion-group"
        },
        {
          "title": "Card",
          "href": "/card"
        },
        {
          "title": "Card Group",
          "href": "/card-group"
        },
        {
          "title": "Callout",
          "href": "/callout"
        },
        {
          "title": "Code Block",
          "href": "/code-block"
        },
        {
          "title": "File Tree",
          "href": "/file-tree"
        },
        {
          "title": "Image",
          "href": "/image"
        },
        {
          "title": "Link",
          "href": "/link"
        },
        {
          "title": "Mermaid",
          "href": "/mermaid"
        },
        {
          "title": "Steps",
          "href": "/steps"
        },
        {
          "title": "Tabs",
          "href": "/tabs"
        },
        {
          "title": "Tooltips",
          "href": "/tooltips"
        },
        {
          "title": "Tables",
          "href": "/tables"
        },
        {
          "title": "Youtube",
          "href": "/youtube"
        }
      ]
    }
  ]
}
